{
  "revision": "011effcf5b8e5b78",
  "source_revision": "0c6d440c961daaad",
  "entries": [
    {
      "label": "Go",
      "parent": "",
      "icon": "",
      "iconFont": "",
      "title": "",
      "target": "",
      "description": "",
      "action": "",
      "provider": "",
      "aliases": [],
      "when": "",
      "checked": "",
      "icon_kind": "none",
      "id": "root",
      "kind": "menu",
      "parent_id": "",
      "conditions": {
        "when": {
          "status": "available",
          "value": true
        },
        "checked": {
          "status": "available",
          "value": null
        }
      },
      "visible": true,
      "checked_state": null,
      "order": 0,
      "route": {
        "route": "host",
        "supported": false,
        "reason": "menu_row_not_invocable",
        "entry_id": "root"
      }
    },
    {
      "label": "Apps",
      "icon": "󰀻",
      "parent": "root",
      "iconFont": "",
      "title": "",
      "target": "",
      "description": "",
      "action": "",
      "provider": "",
      "aliases": [],
      "when": "",
      "checked": "",
      "icon_kind": "glyph",
      "id": "apps",
      "kind": "menu",
      "parent_id": "root",
      "conditions": {
        "when": {
          "status": "available",
          "value": true
        },
        "checked": {
          "status": "available",
          "value": null
        }
      },
      "visible": true,
      "checked_state": null,
      "order": 1,
      "route": {
        "route": "host",
        "supported": false,
        "reason": "menu_row_not_invocable",
        "entry_id": "apps"
      }
    },
    {
      "label": "Trigger",
      "icon": "󰓅",
      "parent": "root",
      "iconFont": "",
      "title": "",
      "target": "",
      "description": "",
      "action": "",
      "provider": "",
      "aliases": [],
      "when": "",
      "checked": "",
      "icon_kind": "glyph",
      "id": "trigger",
      "kind": "menu",
      "parent_id": "root",
      "conditions": {
        "when": {
          "status": "available",
          "value": true
        },
        "checked": {
          "status": "available",
          "value": null
        }
      },
      "visible": true,
      "checked_state": null,
      "order": 2,
      "route": {
        "route": "host",
        "supported": false,
        "reason": "menu_row_not_invocable",
        "entry_id": "trigger"
      }
    },
    {
      "label": "Quiet notifications",
      "icon": "",
      "aliases": [
        "quiet",
        "notify"
      ],
      "action": "",
      "checked": "omarchy-state is-set quiet-notifications",
      "parent": "trigger.toggle",
      "iconFont": "",
      "title": "",
      "target": "",
      "description": "",
      "provider": "",
      "when": "",
      "icon_kind": "none",
      "id": "trigger.toggle.notifications",
      "kind": "menu",
      "parent_id": "trigger.toggle",
      "conditions": {
        "when": {
          "status": "available",
          "value": true
        },
        "checked": {
          "status": "unavailable",
          "value": null,
          "reason": "condition_adapter_unavailable"
        }
      },
      "visible": true,
      "checked_state": null,
      "order": 3,
      "route": {
        "route": "host",
        "supported": false,
        "reason": "menu_row_not_invocable",
        "entry_id": "trigger.toggle.notifications"
      }
    },
    {
      "label": "Herdr keybindings",
      "icon": "󰌌",
      "action": "omarchy-launch-terminal herdr keybindings",
      "when": "command -v herdr",
      "provider": {
        "kind": "static"
      },
      "parent": "learn",
      "iconFont": "",
      "title": "",
      "target": "",
      "description": "",
      "aliases": [],
      "checked": "",
      "icon_kind": "glyph",
      "id": "learn.herdr-keybindings",
      "kind": "action",
      "parent_id": "learn",
      "conditions": {
        "when": {
          "status": "unavailable",
          "value": null,
          "reason": "condition_adapter_unavailable"
        },
        "checked": {
          "status": "available",
          "value": null
        }
      },
      "visible": null,
      "checked_state": null,
      "provider_state": {
        "status": "unavailable",
        "reason": "provider_adapter_unavailable"
      },
      "order": 4,
      "route": {
        "route": "terminal",
        "supported": false,
        "reason": "route adapter is not registered",
        "entry_id": "learn.herdr-keybindings"
      }
    },
    {
      "label": "Notifications (host route fixture)",
      "action": "omarchy-toggle-notifications",
      "parent": "trigger",
      "icon": "",
      "iconFont": "",
      "title": "",
      "target": "",
      "description": "",
      "provider": "",
      "aliases": [],
      "when": "",
      "checked": "",
      "icon_kind": "none",
      "id": "trigger.fixture-host",
      "kind": "action",
      "parent_id": "trigger",
      "conditions": {
        "when": {
          "status": "available",
          "value": true
        },
        "checked": {
          "status": "available",
          "value": null
        }
      },
      "visible": true,
      "checked_state": null,
      "order": 5,
      "route": {
        "route": "host",
        "supported": false,
        "reason": "route adapter is not registered",
        "entry_id": "trigger.fixture-host"
      }
    },
    {
      "label": "setup.monitors",
      "action": "",
      "parent": "setup",
      "icon": "󰍹",
      "iconFont": "",
      "title": "",
      "target": "",
      "description": "",
      "provider": "",
      "aliases": [],
      "when": "",
      "checked": "",
      "icon_kind": "glyph",
      "surface": "native:display-settings",
      "id": "setup.monitors",
      "kind": "menu",
      "parent_id": "setup",
      "conditions": {
        "when": {
          "status": "available",
          "value": true
        },
        "checked": {
          "status": "available",
          "value": null
        }
      },
      "visible": true,
      "checked_state": null,
      "order": 6,
      "route": {
        "route": "native",
        "supported": false,
        "native_view": "display-settings",
        "reason": "route adapter is not registered",
        "entry_id": "setup.monitors"
      }
    },
    {
      "label": "Omodachi",
      "icon": "󰣇",
      "parent": "root",
      "iconFont": "",
      "title": "",
      "target": "",
      "description": "",
      "action": "",
      "provider": "",
      "aliases": [],
      "when": "",
      "checked": "",
      "icon_kind": "glyph",
      "id": "omodachi",
      "kind": "menu",
      "parent_id": "root",
      "conditions": {
        "when": {
          "status": "available",
          "value": true
        },
        "checked": {
          "status": "available",
          "value": null
        }
      },
      "visible": true,
      "checked_state": null,
      "order": 7,
      "route": {
        "route": "host",
        "supported": false,
        "reason": "menu_row_not_invocable",
        "entry_id": "omodachi"
      }
    },
    {
      "label": "Remote screen",
      "surface": "desktop",
      "parent": "omodachi",
      "icon": "",
      "iconFont": "",
      "title": "",
      "target": "",
      "description": "",
      "action": "",
      "provider": "",
      "aliases": [],
      "when": "",
      "checked": "",
      "icon_kind": "none",
      "id": "omodachi.desktop",
      "kind": "menu",
      "parent_id": "omodachi",
      "conditions": {
        "when": {
          "status": "available",
          "value": true
        },
        "checked": {
          "status": "available",
          "value": null
        }
      },
      "visible": true,
      "checked_state": null,
      "order": 8,
      "route": {
        "route": "desktop",
        "supported": true,
        "entry_id": "omodachi.desktop"
      }
    },
    {
      "label": "Agent",
      "surface": "terminal",
      "parent": "omodachi",
      "icon": "",
      "iconFont": "",
      "title": "",
      "target": "",
      "description": "",
      "action": "",
      "provider": "",
      "aliases": [],
      "when": "",
      "checked": "",
      "icon_kind": "none",
      "id": "omodachi.agent",
      "kind": "menu",
      "parent_id": "omodachi",
      "conditions": {
        "when": {
          "status": "available",
          "value": true
        },
        "checked": {
          "status": "available",
          "value": null
        }
      },
      "visible": true,
      "checked_state": null,
      "order": 9,
      "route": {
        "route": "terminal",
        "supported": true,
        "argv": [
          "herdr",
          "agent",
          "attach",
          "default"
        ],
        "entry_id": "omodachi.agent"
      }
    },
    {
      "label": "Herdr",
      "surface": "terminal",
      "parent": "omodachi",
      "icon": "",
      "iconFont": "",
      "title": "",
      "target": "",
      "description": "",
      "action": "",
      "provider": "",
      "aliases": [],
      "when": "",
      "checked": "",
      "icon_kind": "none",
      "id": "omodachi.herdr",
      "kind": "menu",
      "parent_id": "omodachi",
      "conditions": {
        "when": {
          "status": "available",
          "value": true
        },
        "checked": {
          "status": "available",
          "value": null
        }
      },
      "visible": true,
      "checked_state": null,
      "order": 10,
      "route": {
        "route": "terminal",
        "supported": true,
        "entry_id": "omodachi.herdr"
      }
    }
  ],
  "contract_revision": "omodachi.v1"
}
